{
  "schema_version": 1,
  "registry_id": "life-orphan-lock-branch-quarantine-v1",
  "runtime_control_authority": "NONE",
  "entries": [
    {
      "branch": "lock/385ed47b5d7856779a9bc5c28f34b7cb80424b4b567bb054eb6ea16ecc909aab",
      "exact_tip_sha": "0b2611fba37f8b4cb44574264c1463e2d1366126",
      "disposition": "ABANDONED_EMPTY_CLAIM_BRANCH",
      "observed_at": "2026-09-13T09:02:02Z",
      "evidence_refs": [
        "GITHUB_ACTIONS_RUN:34748616720",
        "GITHUB_BRANCH_READBACK:lock/385ed47b5d7856779a9bc5c28f34b7cb80424b4b567bb054eb6ea16ecc909aab@0b2611fba37f8b4cb44574264c1463e2d1366126"
      ]
    }
  ]
}
